<?xml version="1.0" encoding="UTF-8"?>
<ai_templates xmlns:xsi="http://www.w3.org/2001/XMLSchema-instance" xsi:noNamespaceSchemaLocation="ai.xsd">
	<ai npcId="281327">
		<bombs>
			<bomb skillId="16559" />
		</bombs>
	</ai>
	<ai npcId="281212">
		<bombs>
			<bomb skillId="18551" />
		</bombs>
	</ai>
	<ai npcId="281213">
		<bombs>
			<bomb skillId="18551" />
		</bombs>
	</ai>
	<ai npcId="281545">
		<bombs>
			<bomb skillId="18905" cd="4000" />
		</bombs>
	</ai>
	<ai npcId="281756">
		<bombs>
			<bomb skillId="19093" cd="4000" />
		</bombs>
	</ai>
</ai_templates>